<?xml version="1.0" encoding="utf-8"?>
<xs:schema xmlns="http://www.uniovi.es" elementFormDefault="qualified"
	targetNamespace="http://www.uniovi.es" xmlns:xs="http://www.w3.org/2001/XMLSchema">
	<xs:element name="circuito">
		<xs:complexType>
			<xs:sequence>
				<xs:element ref="longitud" />
				<xs:element ref="anchuraMedia" />
				<xs:element ref="referencias" />
				<xs:element ref="fotos" />
				<xs:element ref="videos" />
				<xs:element ref="coordenadas" />
				<xs:element ref="tramos" />
			</xs:sequence>
			<xs:attribute name="nombre" type="xs:string" use="required" />
			<xs:attribute name="fecha" type="xs:date" use="required" />
			<xs:attribute name="hora" type="xs:time" use="required" />
			<xs:attribute name="vueltas" type="xs:integer" use="required" />
			<xs:attribute name="localidad" type="xs:string" use="required" />
			<xs:attribute name="pais" type="xs:string" use="required" />
		</xs:complexType>
	</xs:element>
	<xs:element name="longitud">
		<xs:complexType>
			<xs:sequence>
				<xs:element name="decimalPositivo">
					<xs:simpleType>
						<xs:restriction base="xs:decimal">
							<xs:minInclusive value="0"/>
						</xs:restriction>
					</xs:simpleType>
				</xs:element>
			</xs:sequence>
			<xs:attribute name="medida" type="xs:string" use="required" />
		</xs:complexType>
	</xs:element>
	<xs:element name="anchuraMedia">
		<xs:complexType>
			<xs:sequence>
				<xs:element name="decimalPositivo">
					<xs:simpleType>
						<xs:restriction base="xs:decimal">
							<xs:minInclusive value="0"/>
						</xs:restriction>
					</xs:simpleType>
				</xs:element>
			</xs:sequence>
			<xs:attribute name="medida" type="xs:string" use="required" />
		</xs:complexType>
	</xs:element>
	<xs:element name="referencias">
		<xs:complexType>
			<xs:sequence minOccurs="3" maxOccurs="unbounded">
				<xs:element ref="referencia" />
			</xs:sequence>
		</xs:complexType>
	</xs:element>
	<xs:element name="referencia" type="xs:string" />
	<xs:element name="fotos">
		<xs:complexType>
			<xs:sequence minOccurs="1" maxOccurs="5">
				<xs:element ref="foto" />
			</xs:sequence>
		</xs:complexType>
	</xs:element>
	<xs:element name="foto" type="xs:string" />
	<xs:element name="videos">
		<xs:complexType>
			<xs:sequence minOccurs="0" maxOccurs="3">
				<xs:element ref="video" />
			</xs:sequence>
		</xs:complexType>
	</xs:element>
	<xs:element name="video" type="xs:string" />
	<xs:element name="coordenadas">
		<xs:complexType>
			<xs:simpleContent>
				<xs:extension base="xs:string">
					<xs:attribute name="longitud" type="xs:decimal" use="required" />
					<xs:attribute name="latitud" type="xs:decimal" use="required" />
					<xs:attribute name="altitud" type="xs:decimal" use="required" />
				</xs:extension>
			</xs:simpleContent>
		</xs:complexType>
	</xs:element>
	<xs:element name="tramos">
		<xs:complexType>
			<xs:sequence>
				<xs:element minOccurs="1" maxOccurs="unbounded" ref="punto" />
			</xs:sequence>
		</xs:complexType>
	</xs:element>
	<xs:element name="punto">
		<xs:complexType>
			<xs:sequence>
				<xs:element ref="longitud" />
				<xs:element ref="coordenadas" />
				<xs:element ref="sector" />
			</xs:sequence>
		</xs:complexType>
	</xs:element>
	<xs:element name="sector" type="xs:integer" />
</xs:schema>